{
  "name": "download",
  "signature": ["browser_click"],
  "note": "A click that triggers a file download — pair it with waitForEvent('download') so the listener is registered before the click fires.",
  "example": {
    "steps": [
      { "tool": "browser_click", "element": "Export CSV button" }
    ],
    "code": "const [download] = await Promise.all([\n  page.waitForEvent('download'),\n  page.getByRole('button', { name: 'Export CSV' }).click(),\n]);\nexpect(await download.suggestedFilename()).toContain('.csv');"
  }
}
